{
  "$schema": "https://json-schema.org/draft/2020-12/schema",
  "$id": "https://example.com/sdd/ports.schema.json",
  "title": "SDD lab port mapping",
  "description": "Canonical kind/K8s port assignments. Generated artifacts (infra/k8s/kind-config.yaml extraPortMappings and infra/k8s/overlays/*/service-patch.yaml nodePorts) are derived from this file by tools/sdd_cli/k8s_ports.py.",
  "type": "object",
  "required": ["version", "registry", "appPorts", "environments"],
  "properties": {
    "version": { "type": "integer", "const": 1 },
    "registry": { "type": "string", "description": "Image registry prefix used for all app images" },
    "appPorts": {
      "type": "object",
      "additionalProperties": { "type": "integer" },
      "description": "Container port per appId (must match the app's Dockerfile EXPOSE)"
    },
    "environments": {
      "type": "object",
      "propertyNames": { "enum": ["dev", "qa", "prod"] },
      "additionalProperties": {
        "type": "object",
        "additionalProperties": {
          "type": "object",
          "required": ["hostPort", "nodePort", "role"],
          "properties": {
            "hostPort": {
              "type": "integer",
              "minimum": 1024,
              "maximum": 65535,
              "description": "Host port for kind extraPortMappings (direct localhost access). Allocated per role in blocks of 10 anchored at the role's hostPortBase from infra/deployment/roles.json (shipped: web from 8081, api from 5002, database from 5432). Must be >= the role base, unique across ALL environments, and must not collide with reserved lab service ports (see RESERVED_HOST_PORTS in tools/sdd_cli/k8s_ports.py: Gitea 3000/2222/8123, Nexus 8088/5001, OpenProject 8080, Grafana 3001, probe 8090, Dozzle 8888, Seq 5341)."
            },
            "nodePort": {
              "type": "integer",
              "minimum": 30000,
              "maximum": 32767,
              "description": "Cluster-scoped K8s NodePort (must be unique across environments). Allocated per env per role in blocks of 10 anchored at env_code*1000 + the role's nodePortOffset from infra/deployment/roles.json (shipped: dev web 30080+ / api 30500+ / database 30700+, qa web 31080+ / api 31500+ / database 31700+, prod web 32080+ / api 32500+ / database 32700+). Must stay inside the environment range (dev < 31000, qa < 32000, prod <= 32767)."
            },
            "role": {
              "type": "string",
              "description": "App role driving the port-range scheme (web, api, database, ...). Roles and their ranges are defined in infra/deployment/roles.json — an unknown or missing role fails load_ports validation."
            },
            "serviceName": {
              "type": "string",
              "description": "Optional K8s Service metadata.name override for the port patch and kind mapping (defaults to the appId). Used by infra services whose manifest name differs from the ports.json key — the shared database registers as 'database' but its Service is 'db'."
            }
          }
        }
      }
    }
  }
}
